{"schema":"geometry.step_topology.apply_metadata_probes.result.a0","state":{"session":{"session_handle":"gts_1111111111111111111111111111111111111111111111111111111111111111","generation":8},"edit_journal_revision":1,"accounted_string_bytes":96,"estimated_resident_bytes":4096},"groups":[],"probes":[{"authored_id":"wn.geometer.research.probe.document","revision":1,"target":{"kind":"document"},"key":"wn.geometer.research.probe.key.note","value":"document"}],"diagnostics":[]}
